<?xml version="1.0" encoding="utf-8"?>
<?xml-stylesheet type="text/xsl" href="space4config.xsl"?>
<Space4Config xmlns:xsi="http://www.w3.org/2001/XMLSchema-instance" xsi:noNamespaceSchemaLocation="space4config.xsd">
  <Versions>
    <FileFormat>v1.0.0</FileFormat>
    <Config>v0.0.1</Config>
  </Versions>
  <Sources>
    <Source>
      <Index>0</Index>
      <Type>Media</Type>
      <Name>USB</Name>
    </Source>
    <Source>
      <Index>1</Index>
      <Type>Tuner</Type>
      <Name>AMFM</Name>
    </Source>
  </Sources>
  <Targets>
    <Target>
      <Index>0</Index>
      <Type>Speaker</Type>
      <Name>MainCabin</Name>
    </Target>
    <Target>
      <Index>1</Index>
      <Type>Bluetooth Headset</Type>
      <Name>Codriver</Name>
    </Target>
  </Targets>
  <InputInterfaces>
    <Interface Type="UAIF">
      <Index>0</Index>
      <Name>TunerIn</Name>
      <SampleSpec>
        <SampleFormat>S32LE</SampleFormat>
        <SampleRate>48000</SampleRate>
        <NumOfChannels>2</NumOfChannels>
        <SlotDefinition>0</SlotDefinition>
      </SampleSpec>
      <Direction>Input</Direction>
      <MainTrigger>false</MainTrigger>
      <UAIF_Number>0</UAIF_Number>
      <TxRx>1Rx</TxRx>
      <DriveMode>Master</DriveMode>
      <BCLK_Polarity>Positive</BCLK_Polarity>
      <OneBitShift>true</OneBitShift>
      <DMA>
        <ID>-1</ID>
        <EnableFlag>Enabled</EnableFlag>
        <Function>Pending</Function>
        <BufferType>Discrete</BufferType>
        <BufferUpdate>Yes</BufferUpdate>
        <SampleBankLimit>16</SampleBankLimit>
      </DMA>
    </Interface>
    <Interface Type="IPC">
      <Index>1</Index>
      <Name>MediaIn</Name>
      <SampleSpec>
        <SampleFormat>S32LE</SampleFormat>
        <SampleRate>48000</SampleRate>
        <NumOfChannels>2</NumOfChannels>
        <SlotDefinition>0</SlotDefinition>
      </SampleSpec>
      <Direction>Input</Direction>
    </Interface>
  </InputInterfaces>
  <OutputInterfaces>
    <Interface Type="UAIF">
      <Index>0</Index>
      <Name>SpeakerOut</Name>
      <SampleSpec>
        <SampleFormat>S32LE</SampleFormat>
        <SampleRate>48000</SampleRate>
        <NumOfChannels>8</NumOfChannels>
        <SlotDefinition>0</SlotDefinition>
      </SampleSpec>
      <Direction>Output</Direction>
      <MainTrigger>false</MainTrigger>
      <UAIF_Number>0</UAIF_Number>
      <TxRx>1Tx</TxRx>
      <DriveMode>Master</DriveMode>
      <BCLK_Polarity>Positive</BCLK_Polarity>
      <OneBitShift>false</OneBitShift>
      <DMA>
        <ID>-1</ID>
        <EnableFlag>Enabled</EnableFlag>
        <Function>Normal</Function>
        <BufferType>Continuous</BufferType>
        <BufferUpdate>No</BufferUpdate>
        <SampleBankLimit>16</SampleBankLimit>
      </DMA>
    </Interface>
  </OutputInterfaces>
  <Processings>
    <Processing>
      <Index>0</Index>
      <Type>Resampler</Type>
      <Name>SRC44x48</Name>
      <FramesOfProcessing>48</FramesOfProcessing>
      <InputInfo>
        <SampleFormat>S16LE</SampleFormat>
        <SampleRate>441000</SampleRate>
        <NumOfChannels>2</NumOfChannels>
        <SlotDefinition>0</SlotDefinition>
      </InputInfo>
      <OutputInfo>
        <SampleFormat>S32LE</SampleFormat>
        <SampleRate>48000</SampleRate>
        <NumOfChannels>2</NumOfChannels>
        <SlotDefinition>0</SlotDefinition>
      </OutputInfo>
    </Processing>
    <Processing>
      <Index>1</Index>
      <Type>Crossfade</Type>
      <Name>Mute</Name>
      <FramesOfProcessing>48</FramesOfProcessing>
      <InputInfo>
        <SampleFormat>S32LE</SampleFormat>
        <SampleRate>48000</SampleRate>
        <NumOfChannels>2</NumOfChannels>
        <SlotDefinition>0</SlotDefinition>
      </InputInfo>
      <OutputInfo>
        <SampleFormat>S32LE</SampleFormat>
        <SampleRate>48000</SampleRate>
        <NumOfChannels>2</NumOfChannels>
        <SlotDefinition>0</SlotDefinition>
      </OutputInfo>
    </Processing>
    <Processing>
      <Index>2</Index>
      <Type>Resampler</Type>
      <Name>Extender</Name>
      <FramesOfProcessing>48</FramesOfProcessing>
      <InputInfo>
        <SampleFormat>S32LE</SampleFormat>
        <SampleRate>48000</SampleRate>
        <NumOfChannels>4</NumOfChannels>
        <SlotDefinition>0</SlotDefinition>
      </InputInfo>
      <OutputInfo>
        <SampleFormat>S32LE</SampleFormat>
        <SampleRate>48000</SampleRate>
        <NumOfChannels>8</NumOfChannels>
        <SlotDefinition>0</SlotDefinition>
      </OutputInfo>
    </Processing>
  </Processings>
  <Crossbars>
    <Crossbar>
      <Index>0</Index>
      <Type>XBar</Type>
      <Name>MainXBar</Name>
      <FramesOfProcessing>48</FramesOfProcessing>
      <InputInfo>
        <SampleFormat>S32LE</SampleFormat>
        <SampleRate>48000</SampleRate>
        <NumOfChannels>4</NumOfChannels>
        <SlotDefinition>0</SlotDefinition>
      </InputInfo>
      <OutputInfo>
        <SampleFormat>S32LE</SampleFormat>
        <SampleRate>48000</SampleRate>
        <NumOfChannels>4</NumOfChannels>
        <SlotDefinition>0</SlotDefinition>
      </OutputInfo>
    </Crossbar>
  </Crossbars>
  <Streams>
    <Stream>
      <Index>0</Index>
	  <Type>Entertainment</Type>
      <Name>Media</Name>
      <Source>0</Source>
      <InputInterface>1</InputInterface>
      <Buffers>
        <PeriodSize>2048</PeriodSize>
        <BufferSize>4096</BufferSize>
	  </Buffers>
      <Preprocessings>
        <Processing>0</Processing>
        <Processing>1</Processing>
      </Preprocessings>
      <Crossbar>0</Crossbar>
      <Postprocessings>
        <Processing>2</Processing>
      </Postprocessings>
      <OutputInterface>0</OutputInterface>
      <Target>0</Target>
    </Stream>
    <Stream>
      <Index>1</Index>
	  <Type>Entertainment</Type>
      <Name>Tuner</Name>
      <Source>1</Source>
      <InputInterface>0</InputInterface>
      <Buffers>
        <PeriodSize>2048</PeriodSize>
        <BufferSize>4096</BufferSize>
	  </Buffers>
      <Preprocessings>
        <Processing>0</Processing>
        <Processing>1</Processing>
      </Preprocessings>
      <Crossbar>0</Crossbar>
      <Postprocessings>
        <Processing>2</Processing>
      </Postprocessings>
      <OutputInterface>0</OutputInterface>
      <Target>1</Target>
    </Stream>
  </Streams>
</Space4Config>